{
  "claim_ledger_sha256": "d51ed0544137828e2e46afc763aa8ce9cd1f12b5816c7aec8933b1409f69915c",
  "claims": [
    {
      "allowed_presentation_context": "data_engineering_and_pit_readiness",
      "claim_id": "PITV22-C001",
      "claim_text": "The corrected B0/B1Q/B2 predictor construction preserved 77328 forecast origins and 62266 common-complete origins across 6 outcome assets.",
      "evidence": [
        {
          "path": "artifacts/target_blind_v22/target_blind_common_predictor_manifest_v22.json",
          "sha256": "b0e31927418b1768024db6f79d7c2492f01b1104e8500d903037745dae8fbfdd"
        },
        {
          "path": "artifacts/target_blind_v22/confirmation_readiness_v1.json",
          "sha256": "3ece2d1f75129218a0baffc0f8fdf5127a8be1a91617d71bf153bdb5b1579cfa"
        }
      ],
      "limitation": "These are input-coverage counts, not predictive metrics.",
      "status": "SUPPORTED_TARGET_BLIND"
    },
    {
      "allowed_presentation_context": "timing_assumption",
      "claim_id": "PITV22-C002",
      "claim_text": "The measured live receipt latency campaign is RECONCILED_PARTIAL; Unusual Whales created_at remains only an operational availability proxy at the registered cutoff.",
      "evidence": [
        {
          "path": "docs/provider_timing_pit_contract_v21.md",
          "sha256": "60f026243085eb781491ef19de6fdcdbe1d04e80ef2342e9140b1522ad9c2fbd"
        },
        {
          "path": "docs/provider_timing_claim_matrix_v21.md",
          "sha256": "bbdb94fe82e7dc1a0568a3a01f616ff0fbb44655babafc2e03c820fb02f4ded8"
        },
        {
          "path": "artifacts/gate5_pit/uw_latency_campaign_state_20260901_v1.json",
          "sha256": "e9e43305c541604bee085b6281332b55a03d65c2837aa34b0f77e31532194ca0"
        }
      ],
      "limitation": "The cross-channel design cannot identify backfill or revision and does not prove provider publication time or client receipt time.",
      "status": "PROXY_ONLY"
    },
    {
      "allowed_presentation_context": "timing_assumption",
      "claim_id": "PITV22-C003",
      "claim_text": "FMP plus one minute (with plus two minutes sensitivity) and Massive SIP as-of selection remain conservative study rules.",
      "evidence": [
        {
          "path": "docs/provider_timing_pit_contract_v21.md",
          "sha256": "60f026243085eb781491ef19de6fdcdbe1d04e80ef2342e9140b1522ad9c2fbd"
        },
        {
          "path": "docs/provider_timing_claim_matrix_v21.md",
          "sha256": "bbdb94fe82e7dc1a0568a3a01f616ff0fbb44655babafc2e03c820fb02f4ded8"
        }
      ],
      "limitation": "They do not prove provider or client-side message receipt latency.",
      "status": "STUDY_CONSERVATIVE_RULE"
    },
    {
      "allowed_presentation_context": "data_quality_and_pit_readiness",
      "claim_id": "PITV22-C004",
      "claim_text": "The primary B2 availability sidecar marks 451 of 77328 rows as excluded rather than treating delayed source records as zero activity.",
      "evidence": [
        {
          "path": "artifacts/provider_timing_v22/b2_availability_manifest_v22.json",
          "sha256": "9e1717bb059e938b32280a0b11a26247fe19e5c3f934359fe04e79733f9ec585"
        },
        {
          "path": "artifacts/provider_timing_v22/b2_availability_summary_v22.json",
          "sha256": "49970fd1309e72d18393a69ed518d95affd65c4efce365f499a3c0bbab09a98b"
        },
        {
          "path": "artifacts/target_blind_v22/target_blind_common_predictor_manifest_v22.json",
          "sha256": "b0e31927418b1768024db6f79d7c2492f01b1104e8500d903037745dae8fbfdd"
        }
      ],
      "limitation": "The correction changes eligibility only; it does not validate performance.",
      "status": "SUPPORTED_TARGET_BLIND"
    },
    {
      "allowed_presentation_context": "methodological_limitation",
      "claim_id": "PITV22-C005",
      "claim_text": "Pre-v2.2 sealed results are not eligible for reconciliation.",
      "evidence": [
        {
          "path": "artifacts/target_blind_v22/target_blind_common_predictor_manifest_v22.json",
          "sha256": "b0e31927418b1768024db6f79d7c2492f01b1104e8500d903037745dae8fbfdd"
        },
        {
          "path": "artifacts/target_blind_v22/confirmation_readiness_v1.json",
          "sha256": "3ece2d1f75129218a0baffc0f8fdf5127a8be1a91617d71bf153bdb5b1579cfa"
        },
        {
          "path": "artifacts/provider_timing_v22/b2_availability_manifest_v22.json",
          "sha256": "9e1717bb059e938b32280a0b11a26247fe19e5c3f934359fe04e79733f9ec585"
        },
        {
          "path": "artifacts/provider_timing_v22/b2_availability_summary_v22.json",
          "sha256": "49970fd1309e72d18393a69ed518d95affd65c4efce365f499a3c0bbab09a98b"
        },
        {
          "path": "artifacts/target_blind_v22/target_blind_common_predictor_manifest_v22.json",
          "sha256": "b0e31927418b1768024db6f79d7c2492f01b1104e8500d903037745dae8fbfdd"
        }
      ],
      "limitation": "No prior sign, metric or ranking may be carried into a corrected claim.",
      "status": "BLOCKED_RECONCILIATION"
    },
    {
      "allowed_presentation_context": "research_question_status",
      "claim_id": "PITV22-C006",
      "claim_text": "Whether B1 improves B0 for RV30 is not yet evaluated after PIT v2.2.",
      "evidence": [
        {
          "path": "artifacts/target_blind_v22/target_blind_common_predictor_manifest_v22.json",
          "sha256": "b0e31927418b1768024db6f79d7c2492f01b1104e8500d903037745dae8fbfdd"
        },
        {
          "path": "artifacts/target_blind_v22/confirmation_readiness_v1.json",
          "sha256": "3ece2d1f75129218a0baffc0f8fdf5127a8be1a91617d71bf153bdb5b1579cfa"
        },
        {
          "path": "artifacts/provider_timing_v22/b2_availability_manifest_v22.json",
          "sha256": "9e1717bb059e938b32280a0b11a26247fe19e5c3f934359fe04e79733f9ec585"
        },
        {
          "path": "artifacts/provider_timing_v22/b2_availability_summary_v22.json",
          "sha256": "49970fd1309e72d18393a69ed518d95affd65c4efce365f499a3c0bbab09a98b"
        },
        {
          "path": "artifacts/target_blind_v22/target_blind_common_predictor_manifest_v22.json",
          "sha256": "b0e31927418b1768024db6f79d7c2492f01b1104e8500d903037745dae8fbfdd"
        }
      ],
      "limitation": "A successor method freeze and authorized evaluation are required.",
      "status": "NOT_EVALUATED_AFTER_PIT_CORRECTION"
    },
    {
      "allowed_presentation_context": "research_question_status",
      "claim_id": "PITV22-C007",
      "claim_text": "Whether B2 adds incremental value over B1 is not yet evaluated after PIT v2.2.",
      "evidence": [
        {
          "path": "artifacts/target_blind_v22/target_blind_common_predictor_manifest_v22.json",
          "sha256": "b0e31927418b1768024db6f79d7c2492f01b1104e8500d903037745dae8fbfdd"
        },
        {
          "path": "artifacts/target_blind_v22/confirmation_readiness_v1.json",
          "sha256": "3ece2d1f75129218a0baffc0f8fdf5127a8be1a91617d71bf153bdb5b1579cfa"
        },
        {
          "path": "artifacts/provider_timing_v22/b2_availability_manifest_v22.json",
          "sha256": "9e1717bb059e938b32280a0b11a26247fe19e5c3f934359fe04e79733f9ec585"
        },
        {
          "path": "artifacts/provider_timing_v22/b2_availability_summary_v22.json",
          "sha256": "49970fd1309e72d18393a69ed518d95affd65c4efce365f499a3c0bbab09a98b"
        },
        {
          "path": "artifacts/target_blind_v22/target_blind_common_predictor_manifest_v22.json",
          "sha256": "b0e31927418b1768024db6f79d7c2492f01b1104e8500d903037745dae8fbfdd"
        }
      ],
      "limitation": "The target-blind ledger contains no loss or model output.",
      "status": "NOT_EVALUATED_AFTER_PIT_CORRECTION"
    },
    {
      "allowed_presentation_context": "research_question_status",
      "claim_id": "PITV22-C008",
      "claim_text": "Stability by asset, session segment, volatility regime and latency assumption is not yet evaluated after PIT v2.2.",
      "evidence": [
        {
          "path": "artifacts/target_blind_v22/target_blind_common_predictor_manifest_v22.json",
          "sha256": "b0e31927418b1768024db6f79d7c2492f01b1104e8500d903037745dae8fbfdd"
        },
        {
          "path": "artifacts/target_blind_v22/confirmation_readiness_v1.json",
          "sha256": "3ece2d1f75129218a0baffc0f8fdf5127a8be1a91617d71bf153bdb5b1579cfa"
        },
        {
          "path": "docs/provider_timing_pit_contract_v21.md",
          "sha256": "60f026243085eb781491ef19de6fdcdbe1d04e80ef2342e9140b1522ad9c2fbd"
        },
        {
          "path": "docs/provider_timing_claim_matrix_v21.md",
          "sha256": "bbdb94fe82e7dc1a0568a3a01f616ff0fbb44655babafc2e03c820fb02f4ded8"
        }
      ],
      "limitation": "No corrected forecasts, contrasts or stability payloads were read.",
      "status": "NOT_EVALUATED_AFTER_PIT_CORRECTION"
    }
  ],
  "evaluation_questions": [
    {
      "question_id": "Q1_B1_VERSUS_B0",
      "reason": "A corrected successor evaluation has not been authorised or run.",
      "status": "NOT_EVALUATED_AFTER_PIT_CORRECTION"
    },
    {
      "question_id": "Q2_B2_INCREMENTAL_OVER_B1",
      "reason": "Pre-v2.2 sealed results are not eligible for reconciliation.",
      "status": "NOT_EVALUATED_AFTER_PIT_CORRECTION"
    },
    {
      "question_id": "Q3_STABILITY_BY_ASSET_TIME_REGIME_AND_LATENCY",
      "reason": "No corrected model/evaluation payload has been read.",
      "status": "NOT_EVALUATED_AFTER_PIT_CORRECTION"
    }
  ],
  "model_fit_performed": false,
  "next_required_gate": "SUCCESSOR_METHOD_FREEZE_AND_EXPLICIT_OOS_ACCESS_AUTHORIZATION",
  "no_target_or_metric_payload_read": true,
  "safe_to_open_or_evaluate_oos": "NO",
  "safe_to_reconcile_existing_results": "NO",
  "schema_version": "pit-v22-claim-ledger-v1.0",
  "scope": "target_blind_pit_and_readiness_claims_only",
  "source_hashes": {